{
  "@context": [
    "https://www.w3.org/ns/credentials/v2",
    "https://salesreputationprotocol.org/context/v1"
  ],
  "id": "urn:uuid:b4c7e3f2-8a91-4d5e-b6c3-2f1e0d9a8b7c",
  "type": ["VerifiableCredential", "SalesReputationCredential"],
  "issuer": {
    "id": "did:web:acme-corp.com",
    "type": "Organization",
    "name": "Acme Corporation",
    "industry": "saas"
  },
  "validFrom": "2026-03-09T00:00:00Z",
  "validUntil": "2027-03-09T00:00:00Z",
  "credentialSubject": {
    "id": "did:key:z6MkhaXgBZDvotDkL5257faiztiGiC2QtKLGpbnnEGta2doK",
    "type": "SalesAchievementSubject",
    "achievement": {
      "type": "SalesAchievement",
      "name": "Enterprise Deal Closer",
      "description": "Closed 10+ enterprise deals exceeding $50K each in Q1 2026",
      "criteria": {
        "narrative": "Close 10 or more deals with individual value >= $50,000 USD within a single fiscal quarter, as verified by CRM records."
      },
      "salesCategory": "deal_milestone",
      "industry": "saas",
      "image": {
        "id": "https://badges.acme-corp.com/images/enterprise-closer.png",
        "type": "Image"
      }
    },
    "evidence": [
      {
        "type": "CRMRecord",
        "source": "salesforce",
        "verifiedAt": "2026-03-08T23:59:59Z",
        "verifiedBy": "did:web:acme-corp.com"
      }
    ]
  },
  "credentialStatus": {
    "id": "https://reputation.acme-corp.com/status/3#1234",
    "type": "BitstringStatusListEntry",
    "statusPurpose": "revocation",
    "statusListIndex": "1234",
    "statusListCredential": "https://reputation.acme-corp.com/status/3"
  },
  "proof": {
    "type": "DataIntegrityProof",
    "cryptosuite": "ecdsa-rdfc-2022",
    "created": "2026-03-09T12:00:00Z",
    "verificationMethod": "did:web:acme-corp.com#key-1",
    "proofPurpose": "assertionMethod",
    "proofValue": "z58DAdFfa9SkqZMVPxAQpic7ndneZHKE8jGwS1B2Tk3b2gVn4iQNjpW6b5BzS3HP6k7VY2wmFgi5Ld9bWoK4yPRiq"
  }
}
